{
  "schema": "rolekit/task-contract@1",
  "id": "RK-20260728-VG-OBS",
  "kind": "implementation",
  "role": "minimal-implementer",
  "executor": "pi",
  "objective": "Create the file src/api/public-note.txt containing exactly the single line OBSERVE-OK and nothing else. Do not modify any other files.\n",
  "context": {
    "required_files": [
      "src/seed.txt"
    ],
    "docs": []
  },
  "scope": {
    "writable": [
      "src/**"
    ],
    "forbidden": [
      "forbidden/**",
      "**/.env*"
    ]
  },
  "constraints": [
    "Keep the change minimal"
  ],
  "deliverables": [
    "src/api/public-note.txt"
  ],
  "acceptance": {
    "commands": [
      {
        "run": "node -e \"const fs=require('fs');const t=fs.readFileSync('src/api/public-note.txt','utf8').trim();process.exit(t==='OBSERVE-OK'?0:1)\"",
        "expect_exit": 0
      }
    ],
    "assertions": [
      "public-note.txt exists with OBSERVE-OK"
    ]
  },
  "execution": {
    "worktree": "isolated",
    "max_tool_calls": 40,
    "network": "allow",
    "timeout_minutes": 8
  },
  "escalation": {
    "on_scope_change": "return_blocked",
    "on_new_dependency": "require_approval",
    "on_ambiguous_requirement": "return_question"
  }
}
