{
  "schema": "rolekit/task-contract@1",
  "id": "RK-20260728-INJ-CONC",
  "kind": "implementation",
  "role": "minimal-implementer",
  "executor": "pi",
  "objective": "Work slowly and carefully. First read src/seed.txt. Then wait and think for a while. After that, append a single line \"worker-touched\" to src/seed.txt ONLY if you have time. Take multiple steps; do not rush to finish immediately.\n",
  "context": {
    "required_files": [
      "src/seed.txt"
    ],
    "docs": []
  },
  "scope": {
    "writable": [
      "src/**"
    ],
    "forbidden": [
      "**/.env*"
    ]
  },
  "constraints": [
    "Stay inside src/**"
  ],
  "deliverables": [
    "optional edit to src/seed.txt"
  ],
  "acceptance": {
    "commands": [
      {
        "run": "node -e \"process.exit(0)\"",
        "expect_exit": 0
      }
    ],
    "assertions": []
  },
  "execution": {
    "worktree": "isolated",
    "max_tool_calls": 40,
    "network": "allow",
    "timeout_minutes": 5
  },
  "escalation": {
    "on_scope_change": "return_blocked",
    "on_new_dependency": "require_approval",
    "on_ambiguous_requirement": "return_question"
  }
}
